[
  {
    "name": "Vulnerary",
    "type": "Consumable",
    "effect": "heal",
    "value": 10,
    "uses": 3,
    "price": 300
  },
  {
    "name": "Elixir",
    "type": "Consumable",
    "effect": "healFull",
    "value": 0,
    "uses": 1,
    "price": 1500
  },
  {
    "name": "Master Seal",
    "type": "Consumable",
    "effect": "promote",
    "value": 0,
    "uses": 1,
    "price": 2500
  },
  {
    "name": "Energy Drop",
    "type": "Consumable",
    "effect": "statBoost",
    "stat": "STR",
    "value": 2,
    "uses": 1,
    "price": 2000
  },
  {
    "name": "Spirit Dust",
    "type": "Consumable",
    "effect": "statBoost",
    "stat": "MAG",
    "value": 2,
    "uses": 1,
    "price": 2000
  },
  {
    "name": "Secret Book",
    "type": "Consumable",
    "effect": "statBoost",
    "stat": "SKL",
    "value": 2,
    "uses": 1,
    "price": 2000
  },
  {
    "name": "Speedwing",
    "type": "Consumable",
    "effect": "statBoost",
    "stat": "SPD",
    "value": 2,
    "uses": 1,
    "price": 2500
  },
  {
    "name": "Dracoshield",
    "type": "Consumable",
    "effect": "statBoost",
    "stat": "DEF",
    "value": 2,
    "uses": 1,
    "price": 2000
  },
  {
    "name": "Talisman",
    "type": "Consumable",
    "effect": "statBoost",
    "stat": "RES",
    "value": 2,
    "uses": 1,
    "price": 2000
  },
  {
    "name": "Angelic Robe",
    "type": "Consumable",
    "effect": "statBoost",
    "stat": "HP",
    "value": 5,
    "uses": 1,
    "price": 2500
  },
  {
    "name": "Swiftsoles",
    "type": "Consumable",
    "effect": "statBoost",
    "stat": "MOV",
    "value": 1,
    "uses": 1,
    "price": 3000
  },
  {
    "name": "Infantry Seal",
    "type": "Consumable",
    "effect": "reclass",
    "subEffect": "infantry",
    "value": 0,
    "uses": 1,
    "price": 2000
  },
  {
    "name": "Mounted Seal",
    "type": "Consumable",
    "effect": "reclass",
    "subEffect": "mounted",
    "value": 0,
    "uses": 1,
    "price": 2500
  },
  {
    "name": "Herb",
    "type": "Consumable",
    "effect": "cure",
    "value": 0,
    "uses": 2,
    "price": 400
  },
  {
    "name": "Remedy",
    "type": "Consumable",
    "effect": "cureHeal",
    "value": 10,
    "uses": 1,
    "price": 800
  }
]
