[
  {
    "name": "Poultice",
    "lore": "Apply to the wound, not the mouth. Yes, we have to write that down now.",
    "type": "Consumable",
    "effect": "heal",
    "value": 10,
    "uses": 3,
    "price": 300
  },
  {
    "name": "Elixir",
    "lore": "Price on request. The recipe died with the last temple apothecary.",
    "type": "Consumable",
    "effect": "healFull",
    "value": 0,
    "uses": 1,
    "price": 1500
  },
  {
    "name": "Sovereign Seal",
    "lore": "The crown's own wax. Whoever signs beneath it wakes up promoted, and sore.",
    "type": "Consumable",
    "effect": "promote",
    "value": 0,
    "uses": 1,
    "price": 2500
  },
  {
    "name": "Mightroot",
    "lore": "Chew one root, haul one wagon. Chew two, start one fistfight. Keep from recruits.",
    "type": "Consumable",
    "effect": "statBoost",
    "stat": "STR",
    "value": 2,
    "uses": 1,
    "price": 2000
  },
  {
    "name": "Spellstone Dust",
    "lore": "Ground from a chapel ward-stone. Taken on the tongue, the words come easier.",
    "type": "Consumable",
    "effect": "statBoost",
    "stat": "MAG",
    "value": 2,
    "uses": 1,
    "price": 2000
  },
  {
    "name": "Drill Primer",
    "lore": "Margin note in a second hand: page nine is wrong. Do it my way.",
    "type": "Consumable",
    "effect": "statBoost",
    "stat": "SKL",
    "value": 2,
    "uses": 1,
    "price": 2000
  },
  {
    "name": "Fleet Plume",
    "lore": "A pegasus pinion that still twitches whenever the wind changes.",
    "type": "Consumable",
    "effect": "statBoost",
    "stat": "SPD",
    "value": 2,
    "uses": 1,
    "price": 2500
  },
  {
    "name": "Wyrmscale",
    "lore": "Genuine dragon scale! Sew it over the heart. No refunds issued to the dead.",
    "type": "Consumable",
    "effect": "statBoost",
    "stat": "DEF",
    "value": 2,
    "uses": 1,
    "price": 2000
  },
  {
    "name": "Warding Cord",
    "lore": "Knot of red, knot of white, keep the hex-fire off tonight.",
    "type": "Consumable",
    "effect": "statBoost",
    "stat": "RES",
    "value": 2,
    "uses": 1,
    "price": 2000
  },
  {
    "name": "Blessed Vestment",
    "lore": "Temple linen, blessed once and holding it still. Wear it under the mail.",
    "type": "Consumable",
    "effect": "statBoost",
    "stat": "HP",
    "value": 5,
    "uses": 1,
    "price": 2500
  },
  {
    "name": "Swiftsoles",
    "lore": "Courier guild insoles. Once fitted, they refuse to walk anywhere slowly.",
    "type": "Consumable",
    "effect": "statBoost",
    "stat": "MOV",
    "value": 1,
    "uses": 1,
    "price": 3000
  },
  {
    "name": "Infantry Seal",
    "lore": "Form 9: reassigned to foot. Mount, saddle and dignity returned to stores.",
    "type": "Consumable",
    "effect": "reclass",
    "subEffect": "infantry",
    "value": 0,
    "uses": 1,
    "price": 2000
  },
  {
    "name": "Mounted Seal",
    "lore": "Requisition for one mount, hoof or wing. Feed it first; it will remember.",
    "type": "Consumable",
    "effect": "reclass",
    "subEffect": "mounted",
    "value": 0,
    "uses": 1,
    "price": 2500
  },
  {
    "name": "Herb",
    "lore": "Fen-leaf. Chew slowly. If it tastes worse than the poison, it's working.",
    "type": "Consumable",
    "effect": "cure",
    "value": 0,
    "uses": 2,
    "price": 400
  },
  {
    "name": "Remedy",
    "lore": "Antidote, gauze, and a tin that doubles as a cup. Sells best on fen roads.",
    "type": "Consumable",
    "effect": "cureHeal",
    "value": 10,
    "uses": 1,
    "price": 800
  }
]
